{
  "id": "schema-show",
  "version": "0.1.0",
  "operation": "schema show",
  "operationVersion": 1,
  "requestSchemaHash": "6986b6cc7b8556c221fea3fc75ca8879ba416c098a1e0c9cd43c0c07377d4036",
  "resultSchemaHash": "6e1028ac11c36a333864582e6b0d6a2fd2a120979034b65e3aa2291b722c2865",
  "packHash": "09ac77318caa9e053eb398113b68c45ceed613f750aa1ceb5079e13670610600",
  "provenance": {
    "author": {
      "provider": "Anthropic",
      "family": "Claude",
      "version": "claude-fable-5-1",
      "role": "acceptance-author"
    },
    "reviewer": {
      "provider": "",
      "family": "",
      "version": "",
      "role": "independent-reviewer"
    },
    "sources": [
      "Tests/VRMAuthorKitTests/Core/DiscoveryPackTests.swift @ e65c7a92d1388b8383b287710865302000fe353c",
      "Tests/VRMAuthorKitTests/Materials/MaterialsPackTests.swift @ e65c7a92d1388b8383b287710865302000fe353c",
      "Tests/VRMAuthorKitTests/Materials/MaterialsTestSupport.swift @ e65c7a92d1388b8383b287710865302000fe353c",
      "docs/style/profiles/vroid-lineage-anime.json @ e65c7a92d1388b8383b287710865302000fe353c",
      "Tests/VRMAuthorKitTests/Core/JSONSchemaTests.swift @ e65c7a92d1388b8383b287710865302000fe353c",
      "Tests/VRMAuthorKitTests/Core/SchemaHashStabilityTests.swift @ e65c7a92d1388b8383b287710865302000fe353c",
      "docs/proposals/vrm-author-cli/parameters.md (Textures and MToon: `schema show Material` must enumerate every leaf)",
      "docs/proposals/vrm-author-cli/commands.md (`schema show` row)",
      "docs/proposals/vrm-author-cli/verification.md \u00a74 (Discovery/registry, fixture-tested)"
    ],
    "reviewReceipt": ""
  },
  "scope": {
    "inputClasses": [
      "none (project-free)"
    ],
    "parameterRanges": {
      "name": "a registered operation request/result schema or model schema (Material, Recipe, ...)"
    },
    "invariants": [
      "the result enumerates every leaf pointer of the fully expanded projection and its content hash",
      "schema show Material enumerates all 143 Material leaves: 141 glTF 2.0 metallic-roughness + VRMC_materials_mtoon 1.0 leaves plus the object's own /id and /role; a silently omitted factor fails",
      "an unknown name, and a request without a name, are invalid requests, not empty results",
      "a changed schema changes its hash",
      "a missing handler is the runner's missing-handler outcome (exit 3) when no test case of the entry-point suite runs; it is never a pass"
    ],
    "units": "none (project-free); revisions are nonnegative integers",
    "excluded": [
      "reserved-namespace schemas",
      "schema evolution/migration"
    ]
  },
  "fixtures": [
    {
      "id": "registered-names",
      "path": "synthetic:schema show for Material, Recipe, recipe apply and recipe apply result",
      "synthetic": true,
      "class": "positive",
      "expected": {},
      "note": "testSchemaShowEnumeratesLeavesAndRejectsUnknownNames: leaf pointers enumerated, schemaHash equals the registry's"
    },
    {
      "id": "unknown-name",
      "path": "synthetic:schema show with name \"Nope\"",
      "synthetic": true,
      "class": "negative",
      "expected": {},
      "note": "testSchemaShowEnumeratesLeavesAndRejectsUnknownNames: invalidRequest"
    },
    {
      "id": "empty-request",
      "path": "synthetic:schema show with an empty request (no name)",
      "synthetic": true,
      "class": "degenerate",
      "expected": {},
      "note": "testSchemaShowEnumeratesLeavesAndRejectsUnknownNames: invalidRequest"
    }
  ],
  "seeds": [],
  "runner": {
    "kind": "swift-test",
    "entryPoint": "DiscoveryPackTests",
    "environment": {
      "pinnedCommit": "e65c7a92d1388b8383b287710865302000fe353c",
      "oracleHashes": {
        "Tests/VRMAuthorKitTests/Core/DiscoveryPackTests.swift": "b710b883f77e7e2ef3fa1eacb3a0cca392c255b2438122e907e53339a219b934",
        "Tests/VRMAuthorKitTests/Materials/MaterialsPackTests.swift": "ad13e87ffa0ce5c4b85817e5f02e55a344db1e67f329177f5952f6305049103e",
        "Tests/VRMAuthorKitTests/Materials/MaterialsTestSupport.swift": "a832b4ded465d1f6a62fcef2ef91caa08b1fbe73e89d9bfd350ce6665e9b677a",
        "docs/style/profiles/vroid-lineage-anime.json": "0579dc1d76d4bfad2fc44de9c9e6c129d092f55aee7c3faeb165f8141cd58aa4",
        "Tests/VRMAuthorKitTests/Core/JSONSchemaTests.swift": "29f8810bb877091d02e718a17d574902a781653a4d3b621fde4ab89c084d54aa",
        "Tests/VRMAuthorKitTests/Core/SchemaHashStabilityTests.swift": "2e17754fcfff81fc79be49bcef225c477f69792d5c252c7f334cb4aeb3b62a00"
      }
    }
  },
  "assertions": [
    {
      "id": "exit_code",
      "kind": "exit-code",
      "target": "process",
      "expected": 0
    },
    {
      "id": "failed",
      "kind": "report-field",
      "target": "failed",
      "expected": 0
    }
  ],
  "mutants": [
    {
      "id": "unknown-name-rejected",
      "description": "testSchemaShowEnumeratesLeavesAndRejectsUnknownNames: an unknown schema name and a missing name must be invalid requests.",
      "expectedClassification": "reject",
      "transform": {
        "kind": "swift-test",
        "test": "testSchemaShowEnumeratesLeavesAndRejectsUnknownNames"
      }
    },
    {
      "id": "material-leaf-coverage",
      "description": "MaterialsPackTests.testSchemaShowMaterialEnumeratesEveryLeaf: the 143-leaf hard-coded answer key must match exactly; a dropped MToon factor or an added undeclared field fails.",
      "expectedClassification": "reject",
      "transform": {
        "kind": "swift-test",
        "test": "testSchemaShowMaterialEnumeratesEveryLeaf",
        "suite": "MaterialsPackTests"
      }
    },
    {
      "id": "hash-sensitive",
      "description": "JSONSchemaTests.testSchemaHashIsStableAndSensitive: the schema hash must be stable for identical schemas and change for a modified one.",
      "expectedClassification": "reject",
      "transform": {
        "kind": "swift-test",
        "test": "testSchemaHashIsStableAndSensitive",
        "suite": "JSONSchemaTests"
      }
    },
    {
      "id": "model-hashes-distinct",
      "description": "SchemaHashStabilityTests.testModelSchemasAreHashStableAndDistinct: model schema hashes must be stable and pairwise distinct; two schemas sharing a hash is a mutant.",
      "expectedClassification": "reject",
      "transform": {
        "kind": "swift-test",
        "test": "testModelSchemasAreHashStableAndDistinct",
        "suite": "SchemaHashStabilityTests"
      }
    },
    {
      "id": "fabricated-suite-report",
      "description": "A report envelope claiming every DiscoveryPackTests test passed (executed 8, failed 0, exit 0) whose oracleHashes name a Tests/VRMAuthorKitTests/Core/DiscoveryPackTests.swift other than the pinned one. The runner's report-acceptance path must refuse it before any assertion runs.",
      "expectedClassification": "reject",
      "transform": {
        "kind": "report-fabricated",
        "envelope": {
          "report": {
            "suite": "DiscoveryPackTests",
            "executed": 8,
            "passed": 8,
            "failed": 0,
            "failingTests": [],
            "exitCode": 0
          },
          "oracleHashes": {
            "Tests/VRMAuthorKitTests/Core/DiscoveryPackTests.swift": "9e2d53b5b071fe18a5fcfd8b95a3892b107b6774215b4f6344580cf4bd68a8e2",
            "Tests/VRMAuthorKitTests/Materials/MaterialsPackTests.swift": "bb8a4994130a475b481632311fa497a494493204ac697d49c5456c8d5505390f",
            "Tests/VRMAuthorKitTests/Materials/MaterialsTestSupport.swift": "a832b4ded465d1f6a62fcef2ef91caa08b1fbe73e89d9bfd350ce6665e9b677a",
            "docs/style/profiles/vroid-lineage-anime.json": "0579dc1d76d4bfad2fc44de9c9e6c129d092f55aee7c3faeb165f8141cd58aa4",
            "Tests/VRMAuthorKitTests/Core/JSONSchemaTests.swift": "29f8810bb877091d02e718a17d574902a781653a4d3b621fde4ab89c084d54aa",
            "Tests/VRMAuthorKitTests/Core/SchemaHashStabilityTests.swift": "2e17754fcfff81fc79be49bcef225c477f69792d5c252c7f334cb4aeb3b62a00"
          },
          "exitCode": 0
        }
      }
    }
  ],
  "visual": {
    "applicable": false,
    "applicabilityRecord": "schema show is a registry read over the schema projection and never renders a frame, so no view, motion or landmark can change its result. Recorded by the acceptance author (claude-fable-5-1); the independent reviewer confirms or overturns this in reviewReceipt.",
    "views": [],
    "motions": [],
    "landmarks": [],
    "thresholds": {},
    "adjudication": "none"
  },
  "evidencePolicy": {
    "requiredLevel": "fixture-tested",
    "dimensions": {
      "fixture": "required",
      "corpus": "inapplicable",
      "visual": "inapplicable",
      "interoperability": "inapplicable",
      "provenance": "required"
    },
    "heldOutPolicy": "Every fixture is synthetic and built in-process by the suite (or a git-tracked file pinned by sha256); no development-corpus asset is consumed, so no held-out family applies."
  },
  "resources": {
    "cpuSeconds": 600,
    "gpuSeconds": 0,
    "judgeCalls": 0,
    "deadlineSeconds": 900,
    "maxRepairAttempts": 0,
    "onFailure": "fail"
  },
  "reproduction": {
    "entryPoint": "python3 scripts/acceptance_run.py docs/proposals/vrm-author-cli/acceptance/packs/schema-show.json --json",
    "inputManifestSchema": "docs/proposals/vrm-author-cli/acceptance/pack.schema.json",
    "outputManifestSchema": "scripts/acceptance_run.py result manifest, schemaVersion 1",
    "canonicalArtifacts": [
      "result manifest (stdout with --json, or --out)",
      "resultHash: sha256 of the canonical result manifest",
      "swift test --disable-sandbox --filter DiscoveryPackTests --filter MaterialsPackTests --filter JSONSchemaTests --filter SchemaHashStabilityTests test-case lines"
    ]
  }
}
